{
  "word": "",
  "language": "rki",
  "script": "Mymr",
  "pos": "",
  "definitions": [],
  "pronunciation": {
    "ipa": "",
    "romanization": "",
    "variants": []
  },
  "morphology": {
    "root": "",
    "affixes": [],
    "derived": [],
    "inflections": []
  },
  "examples": [],
  "semantic_relations": {
    "synonyms": [],
    "antonyms": [],
    "hypernyms": [],
    "hyponyms": [],
    "related": []
  },
  "metadata": {
    "frequency": 0,
    "tags": [],
    "source": "",
    "updated_at": ""
  }
}